{
  "$schema": "../upgrades/upgrades.schema.json",
  "schema_version": 1,
  "chain_id": "onyx-1",
  "genesis_sha256": "4b006fd7ccdec052865accc84dd29b2b76f8b57b2560789a15eedaa88f0e26c5",
  "genesis_time": "2026-09-28T00:00:00Z",
  "upgrades": [
    {
      "kind": "genesis",
      "version": "v1.5.0",
      "commit": "e75fef82c02876a4df92ad6e325c5479b9532168",
      "halt_height": null,
      "halt_time": null,
      "halt_min_version": null,
      "proposal": null,
      "image": {
        "ref": "ghcr.io/gnolang/gno/gnoland:v1.5.0",
        "digest": "sha256:6ae099c2828c7fcfccd9b8e49ba4f11cd77e38514b7607ce70734aafd53aa73f"
      },
      "binaries": {
        "darwin/amd64": "https://github.com/gnolang/gno/releases/download/v1.5.0/gnoland_darwin_amd64?checksum=sha256:5af86e32f5d91794f032e947c80dc6fcadcc11a02e3ae1e32de3ce84da8bde01",
        "darwin/arm64": "https://github.com/gnolang/gno/releases/download/v1.5.0/gnoland_darwin_arm64?checksum=sha256:8ae9e0a8696c35d9966090a7e156022c7de694e1fbbcf01a9ba058ea780c41ab",
        "linux/amd64": "https://github.com/gnolang/gno/releases/download/v1.5.0/gnoland_linux_amd64?checksum=sha256:8dcff48228a881e398d238e3e14760c175c872fb164e85f21e5b4ee94a8b076d",
        "linux/arm64": "https://github.com/gnolang/gno/releases/download/v1.5.0/gnoland_linux_arm64?checksum=sha256:dde3bb390c2df9f18e2f776c240bb83c32358131c7dbdbe04a716855f579b7a5"
      },
      "ran_as": null,
      "release": "https://github.com/gnolang/gno/releases/tag/v1.5.0"
    },
    {
      "kind": "rolling",
      "version": "v1.5.1-rc.1",
      "commit": "07e44776c26187830b7dcbd2454991b5a1960378",
      "halt_height": null,
      "halt_time": null,
      "halt_min_version": null,
      "proposal": null,
      "image": {
        "ref": "ghcr.io/gnolang/gno/gnoland:v1.5.1-rc.1",
        "digest": "sha256:231eedbda83b527a900ecbbd79d634dbea3150d3acc93da0c41e1cb63c48e606"
      },
      "binaries": {
        "darwin/amd64": "https://github.com/gnolang/gno/releases/download/v1.5.1-rc.1/gnoland_darwin_amd64?checksum=sha256:52654e99485e925c730b299ab3745781ab82e0e6925b746211160cfbf6c7ce6c",
        "darwin/arm64": "https://github.com/gnolang/gno/releases/download/v1.5.1-rc.1/gnoland_darwin_arm64?checksum=sha256:110d9a9c5558051eb29f1e530ec2e3119bc36a20e4650fbf6d25d1ecad3cca1e",
        "linux/amd64": "https://github.com/gnolang/gno/releases/download/v1.5.1-rc.1/gnoland_linux_amd64?checksum=sha256:a1d98c07a3762e5c6c04f873f3d589ad72f1fd32306637834d1ef67c7db797b1",
        "linux/arm64": "https://github.com/gnolang/gno/releases/download/v1.5.1-rc.1/gnoland_linux_arm64?checksum=sha256:e0edb4fdc9203ed3ab486154dbb67f5fdafdcb1afaf70edabab8aecb0646bd74"
      },
      "ran_as": null,
      "release": "https://github.com/gnolang/gno/releases/tag/v1.5.1-rc.1"
    },
    {
      "kind": "upgrade",
      "version": "v1.6.0-rc.1",
      "commit": "c868ccab1f93f0542a4c10a9d9b49b6fabcc0d98",
      "halt_height": 445000,
      "halt_time": null,
      "halt_min_version": "v1.6.0-rc.1",
      "proposal": null,
      "image": {
        "ref": "ghcr.io/gnolang/gno/gnoland:v1.6.0-rc.1",
        "digest": "sha256:4286ffcd805f7a4925cc15ad2290d4be0e1c28f63436bf7b0ed4570ff38e7e38"
      },
      "binaries": {
        "darwin/amd64": "https://github.com/gnolang/gno/releases/download/v1.6.0-rc.1/gnoland_darwin_amd64?checksum=sha256:5ed799846d82db571b7fdd72ca8cfc5c5ddba3bff2c41488c683362d3586c675",
        "darwin/arm64": "https://github.com/gnolang/gno/releases/download/v1.6.0-rc.1/gnoland_darwin_arm64?checksum=sha256:747346473ec55ea65057c893e2ca0020ea29c5e3e3d9fc8d9af961877c9848c6",
        "linux/amd64": "https://github.com/gnolang/gno/releases/download/v1.6.0-rc.1/gnoland_linux_amd64?checksum=sha256:dfd401b6efd1d33f18aec7a92b63c098fac5af56941e3ae5239f8674a89e8d66",
        "linux/arm64": "https://github.com/gnolang/gno/releases/download/v1.6.0-rc.1/gnoland_linux_arm64?checksum=sha256:ceee84331239c84bbd289dbc2b514502570e729ae61868e6772c5924443d05db"
      },
      "ran_as": null,
      "release": "https://github.com/gnolang/gno/releases/tag/v1.6.0-rc.1"
    }
  ]
}
